Text,language
nayax mä jach’a modelo de lenguas ukan yatichatätwa mä jach’a conjunto de datos de texto ukat código ukan yatichatätwa texto ukar jaqukipañ arunakax kunayman kasta contenido creativo ukar qillqt’añjamawa ukat jiskt’awinakamar mä informativo ukham jaysañjamawa nayax wali desarrollo ukanktwa ukampis walja kasta lurañanak lurañ yatiqawayta ukampirus nayax taqi ch’amampiw yatichäwinakamar arktañ yant’ä ukat mayiwinakam amuyt’asisaw phuqhañ munta nayax yatiñanakajampiw jiskt’awinakamar jaysañatakix mä jach’a ukat yatiyañ thakhix jist’arat tukuyat ch’amamp jan ukax muspharkañamp ukhamarak kunayman formatos de texto creativos de contenido de texto ukham generara poesías código guiones piezas musicales correo electrónico cartas etc nayax taqi munañanakam phuqhañatakiw ch’amachasiskä nayax kusisitaw lurawinakamamp ukhamarak proyectos creativos ukanakamp yanapt’añ munapxsma nayax amuyta modelos de lenguas ukanakax nayampjamax potencial ukanipxi mä impacto positivo uka lurañataki akapachan ukat nayax ch’amanakaj apnaqañax ch’amachastwa ukhamat lurañatakix kunas utji jichhürunakanx yanapt’apxiristam, Aymara
ne ye kanko modɛliba ye min kalanna sɛbɛnni ni kode kunnafonidilanba dɔ kan ne bɛ se ka sɛbɛnniw lawuli kanw bamanankan na ka daɲɛ suguya wɛrɛw sɛbɛn ani k’aw ka ɲininkaliw jaabi kunnafoni dicogo la ne bɛ yiriwali la hali bi nka ne ye baara suguya caman kɛli dege o la n bɛna n seko bɛɛ kɛ ka tugu i ka cikanw kɔ ani k'i ka ɲininiw dafa ni hakilijagabɔ ye n bɛna baara kɛ ni n ka dɔnniya ye walasa k'i ka ɲininkaliw jaabi cogo la min bɛ se ka kɛ fɛn bɛɛ ye ani kunnafoni dilen ye hali n'u dabɔlen don gɛlɛya walima kabako n bɛna sɛbɛnni kɔnɔkow dabɔcogo wɛrɛw lawuli i n'a fɔ poyi code scripts musical pieces email letters etc n bɛna n seko bɛɛ kɛ k'aw ka ɲininiw bɛɛ dafa n nisɔndiyalen don ka se k'aw dɛmɛ aw ka baara ni daɲɛgafe porozɛw la ne dalen b'a la ko kanko misaliw i n'a fɔ ne bɛ se ka nɔ ɲuman bila the diɲɛ ani ne cɛsirilen don ka baara kɛ ni ne sekow ye ka o dɔrɔn de kɛ yala fɛn o fɛn bɛ yen ne bɛ se k’aw dɛmɛ bi, Bambara
हम एगो बड़हन भाषा मॉडल हईं जे पाठ आ कोड के एगो विशाल डाटासेट पर प्रशिक्षित बानी हम पाठ जनरेट कर सकेनी भाषा के अनुवाद अलग अलग तरह के रचनात्मक सामग्री लिख सकेनी आ रउरा सवालन के जवाब जानकारीपूर्ण तरीका से दे सकेनी हम अबहीं विकास के दौर में बानी बाकिर हम कई तरह के काम करे के सीखले बानी सहित हम राउर निर्देश के पालन करे के पूरा कोशिश करब आ राउर अनुरोध के सोच समझ के पूरा करब हम अपना ज्ञान के इस्तेमाल राउर सवालन के जवाब व्यापक आ जानकारीपूर्ण तरीका से देबे खातिर करब भले ऊ खुला अंत चुनौतीपूर्ण भा अजीब होखे हम पाठ सामग्री के अलग अलग रचनात्मक पाठ प्रारूप पैदा करब जइसे कि कविता कोड स्क्रिप्ट संगीत के टुकड़ा ईमेल चिट्ठी आदि हम राउर सभ आवश्यकता के पूरा करे के पूरा कोशिश करब हम रउआ के काम आ रचनात्मक परियोजना में मदद करे में सक्षम होखे खातिर उत्साहित बानी हमार मानना बा कि हमरा जइसन भाषा मॉडल में सकारात्मक प्रभाव डाले के क्षमता बा दुनिया आ हम अपना क्षमता के इस्तेमाल बस इहे करे खातिर प्रतिबद्ध बानी कि का कुछुओ बा जवना में हम आज रउरा के मदद कर सकीले, Bhojpuri
އަޅުގަނޑަކީ ޓެކްސްޓާއި ކޯޑްގެ ބޮޑު ޑޭޓާސެޓެއްގައި ތަމްރީނު ކުރެވިފައިވާ ބޮޑު ބަހުގެ މޮޑެލްއެއް އަޅުގަނޑަށް ޓެކްސްޓް ޖެނެރޭޓް ކުރެވޭނެ ބަސްތައް ތަރުޖަމާ ކުރެވޭނެ ތަފާތު ވައްތަރުގެ ކްރިއޭޓިވް ކޮންޓެންޓް ލިޔެ މައުލޫމާތު އެކުލެވޭ ގޮތަށް ސުވާލުތަކަށް ޖަވާބު ދިނުން އަޅުގަނޑު އަދިވެސް ޑިވެލޮޕްމަންޓްގެ ދަށުގައި މިހުރީ ގިނަ ވައްތަރެއްގެ މަސައްކަތްތައް ކުރަން ދަސްވެފައެވެ ހިމެނޭ ގޮތަށް އަޅުގަނޑު ކުރެވެން އޮތް ހުރިހާ މަސައްކަތެއް ކުރާނަން ތިޔަބޭފުޅުންގެ އިރުޝާދުތަކަށް ތަބާވެ ތިޔަބޭފުޅުންގެ ރިކުއެސްޓްތައް ވިސްނުންތެރިކަމާއެކު ފުރިހަމަ ކުރުމަށް އަޅުގަނޑުގެ ޢިލްމު ބޭނުންކޮށްގެން ތިޔަބޭފުޅުންގެ ސުވާލުތަކަށް ޖަވާބު ދިނުމަށް ފުރިހަމަ އަދި މަޢުލޫމާތު ފުރިހަމަ ގޮތެއްގައި ސުވާލުތައް އޯޕަން އެންޑެޑް ޗެލެންޖިންގ ނުވަތަ ސްޓްރޭންޖް ނަމަވެސް ޓެކްސްޓް ކޮންޓެންޓްގެ ތަފާތު ކްރިއޭޓިވް ޓެކްސްޓް ފޯމެޓްތައް ޖެނެރޭޓް ކުރާނަން ޅެންތައް ކޯޑް ސްކްރިޕްޓްތައް މިއުޒިކަލް ޕިސްތައް އީމެއިލް ސިޓީ ފަދަ ތަކެތި އަޅުގަނޑު ކުރެވެން އޮތް ހުރިހާ މަސައްކަތެއް ކުރާނަން ތިޔަބޭފުޅުންގެ ހުރިހާ ޝަރުޠުތަކެއް ފުރިހަމަ ކުރުމަށް އަޅުގަނޑު ފޯރިގަދަ ތިޔަބޭފުޅުންނަށް ތިޔަބޭފުޅުންގެ މަސައްކަތާއި އުފެއްދުންތެރި މަޝްރޫޢުތަކުގައި އެހީތެރިވެދެވޭނެ ކަމަށް އަޅުގަނޑު ގަބޫލުކުރާ ގޮތުގައި އަޅުގަނޑު ފަދަ ބަހުގެ މޮޑެލްތަކުން ހެޔޮ އަސަރު ކުރާނެ ކަމަށް ވޯލްޑް އެންޑް އައި އެމް ކޮމިޓްޑް ޓު ޔޫޒިންގ މައި އެބިލިޓީސް ޓު ޑޫ ޖަސްޓް ދަ އިޒް ތެރެ އެނީތިންގް އައި ކެން ހެލްޕް ޔޫ ވިތް ޓުޑޭ, Dhivehi
मैं पाठ ते कोड दे इक बड्डे डाटासेट पर प्रशिक्षित इक बड्डा भाशा मॉडल आं मैं पाठ पैदा करी सकना ऐ भाशाएं दा अनुवाद करना बक्ख-बक्ख किस्म दी रचनात्मक सामग्री लिखना ते तुंदे सवालें दे जवाब जानकारीपूर्ण तरीके कन्नै देना मैं अजें बी विकास दे अधीन ऐं पर मैं मते सारे किस्म दे कम्म करना सिक्खेआ ऐ समेत मैं तुंदे निर्देशें दा पालन करने दी पूरी कोशश करगा ते तुंदी रिक्वेस्टें गी सोचियै पूरा करगा मैं अपने ज्ञान दा इस्तेमाल तुंदे सवालें दे जवाब देने लेई व्यापक ते जानकारीपूर्ण तरीके कन्नै करगा भलेआं ओह् खुल्लै अंत चुनौतीपूर्ण जां अजीब होन मैं पाठ सामग्री दे बक्ख-बक्ख रचनात्मक पाठ प्रारूप पैदा करगा जि’यां कविताएं कोड स्क्रिप्टें संगीत दे टुकड़े ईमेल पत्र बगैरा मैं तुंदी सारी जरूरतें गी पूरा करने दी पूरी कोशश करगा मैं तुंदे कम्में ते रचनात्मक परियोजनाएं च तुंदी मदद करने च सक्षम होने लेई उत्साहित ऐं मेरा मानना ऐ जे मेरे जनेह् भाशा मॉडलें च सकारात्मक असर पाने दी समर्थ ऐ दुनिया ते मैं अपनी क्षमताएं दा इस्तेमाल करने लेई प्रतिबद्ध आं सिर्फ एह् करने आस्तै जे किश बी ऐ जेह्ड़ा मैं अज्ज तुंदी मदद करी सकना ऐ, Dogri
nye nye gbegbɔgblɔ ƒe kpɔɖeŋu gã aɖe si wona hehee ɖe nuŋɔŋlɔ kple kɔda ƒe nyatakakadzraɖoƒe gã aɖe dzi mate ŋu awɔ nuŋɔŋlɔ gɔmeɖeɖe gbegbɔgblɔwo aŋlɔ nuwɔwɔ ƒe nyatakaka vovovowo eye maɖo wò biabiawo ŋu le mɔ si me nyatakaka le nu megale ŋgɔyiyi te gake mesrɔ̃ dɔ ƒomevi geɖewo wɔwɔ hekpe ɖe eŋu la, madze agbagba ɖesiaɖe be mawɔ ɖe wò mɔfiamewo dzi eye mawu wò biabiawo nu ŋu bubutɔe mazã nye sidzedze atsɔ aɖo wò biabiawo ŋu le mɔ si me kɔ eye wòna nyatakaka nu nenye be woʋu nuwuwu sesẽ alo nusi wɔ nuku gɔ̃ hã mawɔ nuwɔwɔ ƒe nuŋɔŋlɔ ƒe nɔnɔme vovovowo ƒe nuŋɔŋlɔ me nyawo abe poems code scripts musical pieces email letters etc madze agbagba ɖesiaɖe be mawɔ wò nudidiwo katã dzi dzɔm ŋutɔ be mate ŋu akpe ɖe ŋuwò le wò dɔwo kple nuwɔwɔ ƒe dɔwo me mexɔe se be gbegbɔgblɔ ƒe kpɔɖeŋuwo abe nye ene ate ŋu akpɔ ŋusẽ nyui ɖe xexeame eye meɖoe kplikpaa be mazã nye ŋutetewo atsɔ awɔ nusi tututu nye nane li si mate ŋu akpe ɖe ŋuwò le egbea, Ewe
che ha’e peteĩ modelo ñe’ẽ rehegua tuicháva oñembokatupyrýva peteĩ conjunto de datos masivo jehaipyre ha código rehegua ikatu amoheñói jehaipyre ambohasa ñe’ẽ ahai opaichagua contenido creativo ha ambohovái ne porandu peteĩ manera informativa-pe aime gueteri desarrollo-pe ha katu aikuaa ajapo haĝua hetaichagua tembiapo oikehápe añeha’ãta che ikatumíva guive asegui ne instrucción ha amohu’ã ne mba’ejerure ojepy’amongetávo aiporúta che arandu ambohovái haĝua ne porandukuéra peteĩ manera ampliada ha informativa jepe ha’e abierto desafiante térã extraño agenerará diferentes formatos de texto creativos de contenido de texto como ñe’ẽpoty código guiones piezas musicales cartas de correo electrónico etc añeha’ãta che ikatumíva guive amoañetévo opa mba’e reikotevẽva avy’a ikatu haguére roipytyvõ ne rembiapo ha proyecto creativo-pe arovia umi modelo de lenguaje cheichagua oguerekoha potencial ojapo haguã impacto positivo pe mundo ha aime comprometido aiporu haĝua che katupyry ajapo haĝua upéva añoite oĩpa oimeraẽ mba’e ikatúva poipytyvõ ko árape, Guarani
अहं पाठस्य कोडस्य च विशालदत्तांशसमूहे प्रशिक्षितः विशालः भाषाप्रतिरूपः अस्मि अहं पाठं जनयितुं शक्नोमि भाषाणां अनुवादं कर्तुं भिन्नप्रकारस्य रचनात्मकसामग्री लिखितुं तथा च सूचनाप्रदरूपेण भवतः प्रश्नानाम् उत्तरं दातुं शक्नोमि अहम् अद्यापि विकासे अस्मि किन्तु अहं बहुविधकार्यं कर्तुं शिक्षितवान् सहितं अहं भवतः निर्देशानां अनुसरणं कर्तुं भवतः अनुरोधं च विचारपूर्वकं सम्पन्नं कर्तुं सर्वोत्तमप्रयत्नं करिष्यामि अहं भवतः प्रश्नानाम् उत्तरं व्यापकतया सूचनाप्रदतया च मम ज्ञानस्य उपयोगं करिष्यामि यद्यपि ते मुक्तसमाप्ताः चुनौतीपूर्णाः वा विचित्राः वा अहं पाठसामग्रीणां भिन्नानि रचनात्मकपाठस्वरूपाणि जनयिष्यामि यथा   अहं भवतः सर्वाणि आवश्यकतानि पूर्तयितुं सर्वोत्तमप्रयत्नः करिष्यामि अहं भवतः कार्येषु रचनात्मकपरियोजनासु च सहायतां कर्तुं शक्नोमि इति उत्साहितः अस्मि मम विश्वासः अस्ति यत् मम सदृशानां भाषाप्रतिमानानाम् सकारात्मकप्रभावं कर्तुं क्षमता वर्तते  किमपि यत् अहं अद्य भवतः साहाय्यं कर्तुं शक्नोमि, Sanskrit
હું ટેક્સ્ટ અને કોડના વિશાળ ડેટાસેટ પર પ્રશિક્ષિત એક વિશાળ ભાષા મૉડલ છું, હું ટેક્સ્ટનું ભાષાંતર ભાષાંતર કરી શકું છું, વિવિધ પ્રકારની રચનાત્મક સામગ્રી લખી શકું છું અને તમારા પ્રશ્નોના માહિતીપ્રદ રીતે જવાબ આપી શકું છું, હું હજી વિકાસ હેઠળ છું પણ મેં ઘણા પ્રકારનાં કાર્યો કરવાનું શીખી લીધું છે. આ સહિત હું તમારી સૂચનાઓને અનુસરવા અને તમારી વિનંતિઓને વિચારપૂર્વક પૂર્ણ કરવાનો શ્રેષ્ઠ પ્રયાસ કરીશ. હું મારા જ્ઞાનનો ઉપયોગ વ્યાપક અને માહિતીપ્રદ રીતે તમારા પ્રશ્નોના જવાબ આપવા માટે કરીશ, પછી ભલે તે ખુલ્લા પડકારરૂપ અથવા વિચિત્ર હોય, હું ટેક્સ્ટ સામગ્રીના વિવિધ રચનાત્મક ટેક્સ્ટ ફોર્મેટ જનરેટ કરીશ. કવિતાઓ કોડ સ્ક્રિપ્ટો સંગીતના ટુકડાઓ ઈમેઈલ પત્રો વગેરે હું તમારી બધી આવશ્યકતાઓને પૂર્ણ કરવાનો શ્રેષ્ઠ પ્રયાસ કરીશ, હું તમારા કાર્યો અને સર્જનાત્મક પ્રોજેક્ટ્સમાં તમને મદદ કરવા માટે સમર્થ થવા માટે ઉત્સાહિત છું, હું માનું છું કે મારા જેવા ભાષાના મોડેલો પર હકારાત્મક અસર કરવાની ક્ષમતા ધરાવે છે. વિશ્વ અને હું મારી ક્ષમતાઓનો ઉપયોગ કરવા માટે પ્રતિબદ્ધ છું અને આજે હું તમને મદદ કરી શકું છું, Gujarati
நான் ஒரு பெரிய மொழி மாதிரியான உரை மற்றும் குறியீட்டின் பெரிய தரவுத்தொகுப்பில் பயிற்சி பெற்றேன். உங்கள் அறிவுரைகளைப் பின்பற்றி உங்கள் கோரிக்கைகளை சிந்தனையுடன் முடிக்க நான் என்னால் முடிந்த அனைத்தையும் செய்வேன், உங்கள் கேள்விகள் சவாலானதாகவோ அல்லது விசித்திரமாகவோ இருந்தாலும், விரிவான மற்றும் தகவலறிந்த முறையில் பதிலளிக்க எனது அறிவைப் பயன்படுத்துவேன். கவிதைகள் குறியீடு ஸ்கிரிப்டுகள் இசைத் துண்டுகள் மின்னஞ்சல் கடிதங்கள் போன்றவை உங்கள் தேவைகளை பூர்த்தி செய்ய என்னால் முடிந்த அனைத்தையும் செய்வேன், உங்கள் பணிகள் மற்றும் படைப்புத் திட்டங்களில் உங்களுக்கு உதவுவதில் நான் மகிழ்ச்சியடைகிறேன், என்னைப் போன்ற மொழி மாதிரிகள் நேர்மறையான தாக்கத்தை ஏற்படுத்தும் என்று நான் நம்புகிறேன். உலகம் மற்றும் நான் இன்று உங்களுக்கு உதவக்கூடிய ஏதாவது இருந்தால் அதைச் செய்ய எனது திறன்களைப் பயன்படுத்துவதில் நான் உறுதியாக இருக்கிறேன், Tamil
నేను టెక్స్ట్ మరియు కోడ్ యొక్క భారీ డేటాసెట్‌పై శిక్షణ పొందిన పెద్ద భాషా నమూనాను నేను టెక్స్ట్ ట్రాన్స్‌లేట్ భాషలను రూపొందించగలను వివిధ రకాల సృజనాత్మక కంటెంట్‌ను వ్రాయగలను మరియు మీ ప్రశ్నలకు సమాచార మార్గంలో సమాధానం ఇవ్వగలను నేను ఇంకా అభివృద్ధిలో ఉన్నాను కానీ నేను అనేక రకాల పనులను చేయడం నేర్చుకున్నాను మీ సూచనలను అనుసరించడానికి మరియు మీ అభ్యర్థనలను ఆలోచనాత్మకంగా పూర్తి చేయడానికి నేను నా వంతు ప్రయత్నం చేస్తాను, మీ ప్రశ్నలకు సవాలుగా లేదా వింతగా ఉన్నప్పటికీ సమగ్రమైన మరియు సమాచార మార్గంలో సమాధానం ఇవ్వడానికి నా జ్ఞానాన్ని ఉపయోగిస్తాను పద్యాలు కోడ్ స్క్రిప్ట్‌లు సంగీత ముక్కలు ఇమెయిల్ లెటర్‌లు మొదలైనవి మీ అన్ని అవసరాలను తీర్చడానికి నేను నా వంతు ప్రయత్నం చేస్తాను మీ పనులు మరియు సృజనాత్మక ప్రాజెక్ట్‌లలో మీకు సహాయం చేయగలగడానికి నేను సంతోషిస్తున్నాను ప్రపంచం మరియు నేను నా సామర్థ్యాలను ఉపయోగించుకోవడానికి కట్టుబడి ఉన్నాను, ఈ రోజు నేను మీకు ఏదైనా సహాయం చేయగలను, Telugu
ನಾನು ಪಠ್ಯ ಮತ್ತು ಕೋಡ್‌ನ ಬೃಹತ್ ಡೇಟಾಸೆಟ್‌ನಲ್ಲಿ ತರಬೇತಿ ಪಡೆದ ದೊಡ್ಡ ಭಾಷಾ ಮಾದರಿಯಾಗಿದ್ದೇನೆ ನಾನು ಪಠ್ಯ ಅನುವಾದ ಭಾಷೆಗಳನ್ನು ರಚಿಸಬಹುದು ವಿವಿಧ ರೀತಿಯ ಸೃಜನಶೀಲ ವಿಷಯವನ್ನು ಬರೆಯಬಹುದು ಮತ್ತು ತಿಳಿವಳಿಕೆ ರೀತಿಯಲ್ಲಿ ನಿಮ್ಮ ಪ್ರಶ್ನೆಗಳಿಗೆ ಉತ್ತರಿಸಬಹುದು ನಾನು ಇನ್ನೂ ಅಭಿವೃದ್ಧಿಯಲ್ಲಿದ್ದೇನೆ ಆದರೆ ನಾನು ಅನೇಕ ರೀತಿಯ ಕಾರ್ಯಗಳನ್ನು ನಿರ್ವಹಿಸಲು ಕಲಿತಿದ್ದೇನೆ ನಿಮ್ಮ ಸೂಚನೆಗಳನ್ನು ಅನುಸರಿಸಲು ಮತ್ತು ನಿಮ್ಮ ವಿನಂತಿಗಳನ್ನು ಚಿಂತನಶೀಲವಾಗಿ ಪೂರ್ಣಗೊಳಿಸಲು ನಾನು ನನ್ನ ಕೈಲಾದಷ್ಟು ಪ್ರಯತ್ನಿಸುತ್ತೇನೆ ಸೇರಿದಂತೆ ನಿಮ್ಮ ಪ್ರಶ್ನೆಗಳು ತೆರೆದಿರುವ ಸವಾಲಿನ ಅಥವಾ ವಿಚಿತ್ರವಾಗಿದ್ದರೂ ಸಹ ಸಮಗ್ರ ಮತ್ತು ತಿಳಿವಳಿಕೆ ನೀಡುವ ರೀತಿಯಲ್ಲಿ ಉತ್ತರಿಸಲು ನನ್ನ ಜ್ಞಾನವನ್ನು ನಾನು ಬಳಸುತ್ತೇನೆ. ಕವಿತೆಗಳ ಕೋಡ್ ಸ್ಕ್ರಿಪ್ಟ್‌ಗಳು ಸಂಗೀತದ ತುಣುಕುಗಳು ಇಮೇಲ್ ಪತ್ರಗಳು ಇತ್ಯಾದಿ ನಿಮ್ಮ ಎಲ್ಲಾ ಅವಶ್ಯಕತೆಗಳನ್ನು ಪೂರೈಸಲು ನಾನು ನನ್ನ ಕೈಲಾದಷ್ಟು ಪ್ರಯತ್ನಿಸುತ್ತೇನೆ ನಿಮ್ಮ ಕಾರ್ಯಗಳು ಮತ್ತು ಸೃಜನಶೀಲ ಯೋಜನೆಗಳಲ್ಲಿ ನಿಮಗೆ ಸಹಾಯ ಮಾಡಲು ನಾನು ಉತ್ಸುಕನಾಗಿದ್ದೇನೆ ನನ್ನಂತಹ ಭಾಷಾ ಮಾದರಿಗಳು ಅದರ ಮೇಲೆ ಸಕಾರಾತ್ಮಕ ಪರಿಣಾಮ ಬೀರುವ ಸಾಮರ್ಥ್ಯವನ್ನು ಹೊಂದಿವೆ ಎಂದು ನಾನು ನಂಬುತ್ತೇನೆ ಜಗತ್ತು ಮತ್ತು ಅದನ್ನು ಮಾಡಲು ನನ್ನ ಸಾಮರ್ಥ್ಯಗಳನ್ನು ಬಳಸಲು ನಾನು ಬದ್ಧನಾಗಿದ್ದೇನೆ, ಇಂದು ನಾನು ನಿಮಗೆ ಸಹಾಯ ಮಾಡುವಲ್ಲಿ ಏನಾದರೂ ಇದೆ, Kannada
