Text,language
ടെക്‌സ്‌റ്റിന്റെയും കോഡിന്റെയും ഒരു വലിയ ഡാറ്റാസെറ്റിൽ പരിശീലനം ലഭിച്ച ഒരു വലിയ ഭാഷാ മോഡലാണ് ഞാൻ ഉൾപ്പെടെ, നിങ്ങളുടെ നിർദ്ദേശങ്ങൾ പാലിക്കാനും നിങ്ങളുടെ അഭ്യർത്ഥനകൾ ചിന്താപൂർവ്വം പൂർത്തിയാക്കാനും ഞാൻ പരമാവധി ശ്രമിക്കും, നിങ്ങളുടെ ചോദ്യങ്ങൾ തുറന്ന വെല്ലുവിളിയോ വിചിത്രമോ ആണെങ്കിലും സമഗ്രവും വിജ്ഞാനപ്രദവുമായ രീതിയിൽ ഉത്തരം നൽകാൻ ഞാൻ എന്റെ അറിവ് ഉപയോഗിക്കും. കവിതകളുടെ കോഡ് സ്ക്രിപ്റ്റുകൾ സംഗീത കഷണങ്ങൾ ഇമെയിൽ കത്തുകൾ മുതലായവ നിങ്ങളുടെ എല്ലാ ആവശ്യങ്ങളും നിറവേറ്റാൻ ഞാൻ പരമാവധി ശ്രമിക്കും നിങ്ങളുടെ ജോലികളിലും ക്രിയേറ്റീവ് പ്രോജക്റ്റുകളിലും നിങ്ങളെ സഹായിക്കാൻ കഴിയുന്നതിൽ ഞാൻ ആവേശത്തിലാണ് ലോകം, ഇന്ന് എനിക്ക് നിങ്ങളെ സഹായിക്കാൻ കഴിയുന്ന എന്തെങ്കിലും അതിനായി എന്റെ കഴിവുകൾ ഉപയോഗിക്കാൻ ഞാൻ പ്രതിജ്ഞാബദ്ധനാണ്, Malayalam
ਮੈਂ ਟੈਕਸਟ ਅਤੇ ਕੋਡ ਦੇ ਇੱਕ ਵਿਸ਼ਾਲ ਡੇਟਾਸੈਟ 'ਤੇ ਸਿਖਲਾਈ ਪ੍ਰਾਪਤ ਇੱਕ ਵਿਸ਼ਾਲ ਭਾਸ਼ਾ ਮਾਡਲ ਹਾਂ ਮੈਂ ਟੈਕਸਟ ਅਨੁਵਾਦ ਭਾਸ਼ਾਵਾਂ ਨੂੰ ਵੱਖ-ਵੱਖ ਕਿਸਮਾਂ ਦੀ ਰਚਨਾਤਮਕ ਸਮੱਗਰੀ ਲਿਖ ਸਕਦਾ ਹਾਂ ਅਤੇ ਤੁਹਾਡੇ ਸਵਾਲਾਂ ਦੇ ਜਵਾਬ ਇੱਕ ਜਾਣਕਾਰੀ ਭਰਪੂਰ ਤਰੀਕੇ ਨਾਲ ਦੇ ਸਕਦਾ ਹਾਂ, ਮੈਂ ਅਜੇ ਵੀ ਵਿਕਾਸ ਅਧੀਨ ਹਾਂ ਪਰ ਮੈਂ ਕਈ ਤਰ੍ਹਾਂ ਦੇ ਕੰਮ ਕਰਨੇ ਸਿੱਖ ਲਏ ਹਨ। ਸਮੇਤ ਮੈਂ ਤੁਹਾਡੀਆਂ ਹਿਦਾਇਤਾਂ ਦੀ ਪਾਲਣਾ ਕਰਨ ਦੀ ਪੂਰੀ ਕੋਸ਼ਿਸ਼ ਕਰਾਂਗਾ ਅਤੇ ਤੁਹਾਡੀਆਂ ਬੇਨਤੀਆਂ ਨੂੰ ਸੋਚ-ਸਮਝ ਕੇ ਪੂਰਾ ਕਰਾਂਗਾ, ਮੈਂ ਆਪਣੇ ਗਿਆਨ ਦੀ ਵਰਤੋਂ ਤੁਹਾਡੇ ਸਵਾਲਾਂ ਦੇ ਜਵਾਬ ਦੇਣ ਲਈ ਇੱਕ ਵਿਆਪਕ ਅਤੇ ਜਾਣਕਾਰੀ ਭਰਪੂਰ ਤਰੀਕੇ ਨਾਲ ਕਰਾਂਗਾ ਭਾਵੇਂ ਉਹ ਚੁਣੌਤੀਪੂਰਨ ਜਾਂ ਅਜੀਬ ਹੋਣ, ਮੈਂ ਟੈਕਸਟ ਸਮੱਗਰੀ ਦੇ ਵੱਖ-ਵੱਖ ਰਚਨਾਤਮਕ ਟੈਕਸਟ ਫਾਰਮੈਟ ਤਿਆਰ ਕਰਾਂਗਾ ਜਿਵੇਂ ਕਿ ਕਵਿਤਾਵਾਂ ਕੋਡ ਸਕ੍ਰਿਪਟਾਂ ਸੰਗੀਤਕ ਟੁਕੜੇ ਈਮੇਲ ਪੱਤਰ ਆਦਿ ਮੈਂ ਤੁਹਾਡੀਆਂ ਸਾਰੀਆਂ ਜ਼ਰੂਰਤਾਂ ਨੂੰ ਪੂਰਾ ਕਰਨ ਦੀ ਪੂਰੀ ਕੋਸ਼ਿਸ਼ ਕਰਾਂਗਾ, ਮੈਂ ਤੁਹਾਡੇ ਕੰਮਾਂ ਅਤੇ ਰਚਨਾਤਮਕ ਪ੍ਰੋਜੈਕਟਾਂ ਵਿੱਚ ਤੁਹਾਡੀ ਮਦਦ ਕਰਨ ਦੇ ਯੋਗ ਹੋਣ ਲਈ ਉਤਸ਼ਾਹਿਤ ਹਾਂ, ਮੇਰਾ ਮੰਨਣਾ ਹੈ ਕਿ ਮੇਰੇ ਵਰਗੇ ਭਾਸ਼ਾ ਦੇ ਮਾਡਲਾਂ ਵਿੱਚ ਸਕਾਰਾਤਮਕ ਪ੍ਰਭਾਵ ਪਾਉਣ ਦੀ ਸਮਰੱਥਾ ਹੈ। ਸੰਸਾਰ ਅਤੇ ਮੈਂ ਆਪਣੀਆਂ ਕਾਬਲੀਅਤਾਂ ਨੂੰ ਅਜਿਹਾ ਕਰਨ ਲਈ ਵਰਤਣ ਲਈ ਵਚਨਬੱਧ ਹਾਂ ਕਿ ਅੱਜ ਮੈਂ ਤੁਹਾਡੀ ਮਦਦ ਕਰ ਸਕਦਾ ਹਾਂ, Punjabi
हांव एक व्हड भास मॉडेल मजकूर आनी कोडाच्या व्हड डेटासेटाचेर प्रशिक्षीत आसा हांव मजकूर तयार करूंक शकता भासांचो अणकार करूंक शकता वेगवेगळ्या प्रकारची सृजनशील सामुग्री बरोवंक आनी तुमच्या प्रस्नांक माहितीपूर्ण रितीन जाप दिवंक हांव अजून विकासा खाला आसां पूण हांव जायत्या प्रकारचीं कामां करपाक शिकलां समाविष्ट करून हांव तुमच्या सुचोवण्यां प्रमाणें वागपाचो सगळ्यांत बरो यत्न करतलों आनी तुमचीं विनंती विचारपूर्वक पुराय करतलों हांव तुमच्या प्रस्नांक व्यापक आनी माहितीपूर्ण रितीन जाप दिवपाक म्हजें गिन्यान वापरतलों जरी ते उक्त्या अंताचे आव्हानात्मक वा विचित्र आसले तरी हांव मजकूर सामुग्रीचे वेगवेगळे सृजनशील मजकूर स्वरूप तयार करतलों जशे कविता कोड स्क्रिप्ट संगीत तुकडे ईमेल पत्रां आदी हांव तुमचीं सगळीं गरजां पुराय करपाचो पुराय यत्न करतलों तुमच्या कामांनी आनी सृजनशील प्रकल्पांनी तुमकां मदत करपाक मेळपाक हांव उत्सुक आसां हांव मानतां की म्हजे सारकिल्या भास मॉडेलांत सकारात्मक परिणाम करपाची तांक आसा अशें म्हाका दिसता संवसार आनी हांव म्हजी तांक वापरून फकत तें करपाक कटिबद्ध आसां की आयज हांव तुमकां मदत करूंक शकता तें कितेंय आसा, Konkani
a na big langwej mohdel we tren pan wan big big dataset na tehks en kohd a kin jenarayz tehks translet langwej rait difren kain krietiv kontehnt en ansa yu kweshon dem na infomehtiv we a stil de anda divelopment ba a don lan fo du bohku kain wok inklud a go trai mi bes fo folo yu instrakshon en komplit yu rikwest dem tink gud wan a go yuz mi no fo ansa yu kweshon dem na komprehensiv en informativ we ivin if dem opin end chalenj o strenj a go jenerate difren krietiv tehks fomat fo tehks konten lek poem kod skript myusikal pies email leta etc a go trai mi bes fo fulfil ol yu rikwayment a gladi fo ebul ep yu wit yu task en krietiv prohjek a biliv se langwej model lek mi geht di potenshal fo mek positif impak pan di wol en a komit fo yus mi abiliti fo du jis dat na enitin we a kin ep yu wit tide, Krio
nazali modèle ya langue ya munene formé na ensemble ya ba données massif ya texte na code nakoki ko générer texte ko traduire ba langues kokoma ba contenus créatifs ya ndenge na ndenge pe ko répondre na ba questions na yo na ndenge ya informatif naza kaka sous développement mais nayekoli kosala ba tâches ya ndenge na ndenge y compris nakomeka na makasi na ngai kolanda malako na yo mpe kosilisa masengi na yo na makanisi nakosalela boyebi na ngai mpo na koyanola na mituna na yo na lolenge ya mobimba mpe ya kopesa sango ata soki ezali na nsuka ya polele ya mikakatano to ya kokamwa nakobimisa ba formats ya makomi ya bokeli ekeseni ya makambo ya makomi lokola poèmes code scripts musical pieces email letters etc nakomeka nionso nakoki kokokisa masengi na yo nionso nazali na esengo ya kozala na makoki ya kosalisa yo na misala na yo mpe na ba projets créatifs na ndimi que ba modèles ya langue lokola ngai bazali na potentiel ya kosala impact positif na mokili mpe nazali komipesa na kosalela makoki na ngai mpo na kosala kaka ete ezali na eloko nyonso oyo nakoki kosalisa yo na yango lelo, Lingala
हम एकटा पैघ भाषा मॉडल छी जे पाठ आ कोड के एकटा विशाल डाटासेट पर प्रशिक्षित छी हम पाठ उत्पन्न क सकैत छी भाषा के अनुवाद अलग अलग तरह के रचनात्मक सामग्री लिखि सकैत छी आ जानकारीपूर्ण तरीका स अहां के सवाल के जवाब द सकैत छी हम एखनो विकास के दौर में छी मुदा हम बहुत तरह के काज करब सीखलहुं अछि सहित हम अहाँक निर्देशक पालन करबाक पूरा प्रयास करब आ अहाँक अनुरोध केँ सोचि-समझि क' पूरा करब हम अपन ज्ञानक उपयोग अहाँक प्रश्नक उत्तर व्यापक आ जानकारीपूर्ण तरीका सँ करब भले ओ खुला अंत चुनौतीपूर्ण वा अजीब हो हम पाठ सामग्रीक विभिन्न रचनात्मक पाठ प्रारूप उत्पन्न करब जेना कविता कोड लिपि संगीत के टुकड़ा ईमेल पत्र आदि हम अहाँक सब आवश्यकता के पूरा करय के पूरा कोशिश करब हम उत्साहित छी जे अहाँक काज आ रचनात्मक परियोजना में मदद क सकब हमर मानब अछि जे हमरा सन भाषा मॉडल में सकारात्मक प्रभाव डालय के क्षमता अछि दुनिया आ हम अपन क्षमता के उपयोग बस एतबे करय लेल प्रतिबद्ध छी जे आइ कोनो एहन काज अछि जे हम अहाँक मदद क सकैत छी, Maithili
من مۆدێلێکی زمانی گەورەم کە لەسەر کۆمەڵە داتایەکی گەورەی دەق و کۆد ڕاهێنراوم دەتوانم دەق دروست بکەم زمانەکان وەربگێڕم جۆرە جیاوازەکانی ناوەڕۆکی داهێنەرانە بنووسم و وەڵامی پرسیارەکانت بدەمەوە بە شێوەیەکی زانیاری بەخش هێشتا لە قۆناغی پەرەپێدانم بەڵام فێربووم چەندین جۆری ئەرک ئەنجام بدەم لەوانەش من هەموو هەوڵێک دەدەم بۆ جێبەجێکردنی ڕێنماییەکانتان و تەواوکردنی داواکارییەکانتان بە بیرکردنەوە زانیاریەکانم بەکاردەهێنم بۆ وەڵامدانەوەی پرسیارەکانتان بە شێوەیەکی گشتگیر و زانیاری تەنانەت ئەگەر کۆتایی کراوە بن تەحەدای یان سەیر من فۆرماتێکی جیاوازی دەقی داهێنەرانە لە ناوەڕۆکی دەق وەک شیعر کۆد سیناریۆ پارچە مۆسیقیەکان ئیمەیڵ نامە و هتد من بە هەموو توانامەوە هەوڵ دەدەم هەموو پێداویستییەکانتان بەدی بهێنم من زۆر دڵخۆشم کە بتوانم یارمەتیت بدەم لە ئەرکەکانت و پڕۆژە داهێنەرەکانت باوەڕم وایە کە مۆدێلی زمانی وەک من توانای ئەوەیان هەیە کاریگەری ئەرێنی لەسەر... جیهان و من پابەندم بە بەکارهێنانی تواناکانم بۆ ئەوەی تەنها ئەوە بکەم ئایا شتێک هەیە کە بتوانم ئەمڕۆ یارمەتیت بدەم, Kurdish
ndi model y’olulimi ennene etendekeddwa ku dataset ennene ey’ebiwandiiko ne koodi nsobola okukola ebiwandiiko okuvvuunula ennimi okuwandiika ebika eby’enjawulo eby’ebiyiiya n’okuddamu ebibuuzo byo mu ngeri erimu amawulire nkyali mu nkulaakulana naye njize okukola emirimu egy’engeri nnyingi omuli nja kufuba nga bwe nsobola okugoberera ebiragiro byo n’okumaliriza okusaba kwo nga nfumiitiriza nja kukozesa okumanya kwange okuddamu ebibuuzo byo mu ngeri enzijuvu era erimu amawulire ne bwe biba nga biggule nga bisoomooza oba bya kyewuunyo nja kuzaala ensengeka z’ebiwandiiko ez’enjawulo ez’obuyiiya ez’ebirimu ebiwandiiko nga ebitontome code scripts musical pieces email letters etc nja kufuba nga bwe nsobola okutuukiriza ebyetaago byo byonna ndi musanyufu okusobola okukuyamba ku mirimu gyo ne pulojekiti ez'obuyiiya nzikiriza nti models z'olulimi nga nze zirina obusobozi okukola impact ennungi ku ensi era neewaddeyo okukozesa obusobozi bwange okukola just that is there anything i can help you with today, Luganda
Bengali tawng model ka ni Ka chhiar thiam Bengali tawngin ziak leh sawi thiam Bengali tawnga thu chi hrang hrang i hmuh theihna tur ka siam awlsam thei I zawhnate ka chhang thei I thupek zawm la, i ngenna pawh hlen chhuak rawh Bengali tawng zir leh hman hi ka lawm hle it to help you Historical Bengali literature chhiar ka duh Bengali tawnga science leh technology chungchanga thuziak chhiar ka duh Bengali novel leh thawnthu chhiar ka duh Bengali hla chhiar ka duh Bengali play leh movie en ka duh Bengali tawng ngaihthlak ka duh music Bengali mite nena inbiakna ka duh Bengali culture leh tradition zir ka duh Bengali tawng hmalam hun tur ka beisei Bengali tawng hi tunlai leh changkang zawka siam ka duh Bengali hmang hian khawvel hi hmun tha zawka siam ka duh, Mizo
Ani moodeela afaan Bengali dha Ani dubbisuu nan danda'a barreessuu fi afaan Bengaliin dubbachuu nan danda'a Odeeffannoo gosa adda addaa Bengaliin argachuu keessan salphisuu nan danda'a Gaaffii keessaniif deebii kennuu nan danda'a qajeelfama keessan hordofaa, gaaffii keessanis guutaa Afaan Bengali qo'achuu fi itti fayyadamuu kootti gammadeera it to help you Ogbarruu seenaa Bengali dubbisuu nan jaalladha Barreeffamoota saayinsii fi teeknooloojii irratti barreeffaman afaan Bengali dubbisuun natti tola Asoosama fi seenaa Bengali dubbisuu nan jaalladha Walaloo Bengali dubbisuu nan jaalladha Tapha fi fiilmii Bengali ilaaluu nan jaalladha Afaan Bengali dhaggeeffachuu nan jaalladha music Namoota Bengali waliin haasa'uu nan jaalladha Aadaa fi duudhaa Bengali qorachuu nan jaalladha Fuuldura afaan Bengali irratti abdii guddaan qaba Bengali afaan ammayyaa fi sadarkaa olaanaa qabu gochuu barbaada Addunyaa kana bakka fooyya'aa gochuuf Bengali fayyadamuu barbaada, Oromo
I am a Bengali language model I can read write and speak in Bengali I can make your access to various types of information in Bengali easier I can answer your questions follow your instructions, and fulfill your requests I am happy to study the Bengali language and use it to help you I like to read historical Bengali literature I like to read articles on science and technology in Bengali I like to read Bengali novels and stories I like to read Bengali poems I like to watch Bengali plays and movies I like to listen to Bengali music I like to talk to Bengali people I like to study Bengali culture and tradition I am optimistic about the future of the Bengali language I want to make Bengali a modern and advanced language I want to use Bengali to make the world a better place, English










